No.     Time           Source                Destination           Protocol Length Info
      1 0.000000       127.0.0.1             127.0.0.1             TCP      74     38050 → 22 [SYN] Seq=0 Win=65495 Len=0 MSS=65495 SACK_PERM=1 TSval=1780136033 TSecr=0 WS=128

Frame 1: 74 bytes on wire (592 bits), 74 bytes captured (592 bits)
Ethernet II, Src: 00:00:00_00:00:00 (00:00:00:00:00:00), Dst: 00:00:00_00:00:00 (00:00:00:00:00:00)
Internet Protocol Version 4, Src: 127.0.0.1, Dst: 127.0.0.1
Transmission Control Protocol, Src Port: 38050, Dst Port: 22, Seq: 0, Len: 0

No.     Time           Source                Destination           Protocol Length Info
      2 0.000010       127.0.0.1             127.0.0.1             TCP      74     22 → 38050 [SYN, ACK] Seq=0 Ack=1 Win=65483 Len=0 MSS=65495 SACK_PERM=1 TSval=1780136033 TSecr=1780136033 WS=128

Frame 2: 74 bytes on wire (592 bits), 74 bytes captured (592 bits)
Ethernet II, Src: 00:00:00_00:00:00 (00:00:00:00:00:00), Dst: 00:00:00_00:00:00 (00:00:00:00:00:00)
Internet Protocol Version 4, Src: 127.0.0.1, Dst: 127.0.0.1
Transmission Control Protocol, Src Port: 22, Dst Port: 38050, Seq: 0, Ack: 1, Len: 0

No.     Time           Source                Destination           Protocol Length Info
      3 0.000019       127.0.0.1             127.0.0.1             TCP      66     38050 → 22 [ACK] Seq=1 Ack=1 Win=65536 Len=0 TSval=1780136033 TSecr=1780136033

Frame 3: 66 bytes on wire (528 bits), 66 bytes captured (528 bits)
Ethernet II, Src: 00:00:00_00:00:00 (00:00:00:00:00:00), Dst: 00:00:00_00:00:00 (00:00:00:00:00:00)
Internet Protocol Version 4, Src: 127.0.0.1, Dst: 127.0.0.1
Transmission Control Protocol, Src Port: 38050, Dst Port: 22, Seq: 1, Ack: 1, Len: 0

No.     Time           Source                Destination           Protocol Length Info
      4 0.000647       127.0.0.1             127.0.0.1             SSHv2    107    Client: Protocol (SSH-2.0-OpenSSH_8.3p1 Ubuntu-1ubuntu0.1)

Frame 4: 107 bytes on wire (856 bits), 107 bytes captured (856 bits)
Ethernet II, Src: 00:00:00_00:00:00 (00:00:00:00:00:00), Dst: 00:00:00_00:00:00 (00:00:00:00:00:00)
Internet Protocol Version 4, Src: 127.0.0.1, Dst: 127.0.0.1
Transmission Control Protocol, Src Port: 38050, Dst Port: 22, Seq: 1, Ack: 1, Len: 41
SSH Protocol

No.     Time           Source                Destination           Protocol Length Info
      5 0.000653       127.0.0.1             127.0.0.1             TCP      66     22 → 38050 [ACK] Seq=1 Ack=42 Win=65536 Len=0 TSval=1780136033 TSecr=1780136033

Frame 5: 66 bytes on wire (528 bits), 66 bytes captured (528 bits)
Ethernet II, Src: 00:00:00_00:00:00 (00:00:00:00:00:00), Dst: 00:00:00_00:00:00 (00:00:00:00:00:00)
Internet Protocol Version 4, Src: 127.0.0.1, Dst: 127.0.0.1
Transmission Control Protocol, Src Port: 22, Dst Port: 38050, Seq: 1, Ack: 42, Len: 0

No.     Time           Source                Destination           Protocol Length Info
      6 0.014449       127.0.0.1             127.0.0.1             SSHv2    107    Server: Protocol (SSH-2.0-OpenSSH_8.3p1 Ubuntu-1ubuntu0.1)

Frame 6: 107 bytes on wire (856 bits), 107 bytes captured (856 bits)
Ethernet II, Src: 00:00:00_00:00:00 (00:00:00:00:00:00), Dst: 00:00:00_00:00:00 (00:00:00:00:00:00)
Internet Protocol Version 4, Src: 127.0.0.1, Dst: 127.0.0.1
Transmission Control Protocol, Src Port: 22, Dst Port: 38050, Seq: 1, Ack: 42, Len: 41
SSH Protocol

No.     Time           Source                Destination           Protocol Length Info
      7 0.014498       127.0.0.1             127.0.0.1             TCP      66     38050 → 22 [ACK] Seq=42 Ack=42 Win=65536 Len=0 TSval=1780136047 TSecr=1780136047

Frame 7: 66 bytes on wire (528 bits), 66 bytes captured (528 bits)
Ethernet II, Src: 00:00:00_00:00:00 (00:00:00:00:00:00), Dst: 00:00:00_00:00:00 (00:00:00:00:00:00)
Internet Protocol Version 4, Src: 127.0.0.1, Dst: 127.0.0.1
Transmission Control Protocol, Src Port: 38050, Dst Port: 22, Seq: 42, Ack: 42, Len: 0

No.     Time           Source                Destination           Protocol Length Info
      8 0.014702       127.0.0.1             127.0.0.1             SSHv2    1578   Client: Key Exchange Init

Frame 8: 1578 bytes on wire (12624 bits), 1578 bytes captured (12624 bits)
Ethernet II, Src: 00:00:00_00:00:00 (00:00:00:00:00:00), Dst: 00:00:00_00:00:00 (00:00:00:00:00:00)
Internet Protocol Version 4, Src: 127.0.0.1, Dst: 127.0.0.1
Transmission Control Protocol, Src Port: 38050, Dst Port: 22, Seq: 42, Ack: 42, Len: 1512
SSH Protocol

No.     Time           Source                Destination           Protocol Length Info
      9 0.015562       127.0.0.1             127.0.0.1             SSHv2    1122   Server: Key Exchange Init

Frame 9: 1122 bytes on wire (8976 bits), 1122 bytes captured (8976 bits)
Ethernet II, Src: 00:00:00_00:00:00 (00:00:00:00:00:00), Dst: 00:00:00_00:00:00 (00:00:00:00:00:00)
Internet Protocol Version 4, Src: 127.0.0.1, Dst: 127.0.0.1
Transmission Control Protocol, Src Port: 22, Dst Port: 38050, Seq: 42, Ack: 1554, Len: 1056
SSH Protocol

No.     Time           Source                Destination           Protocol Length Info
     10 0.016624       127.0.0.1             127.0.0.1             SSHv2    114    Client: Elliptic Curve Diffie-Hellman Key Exchange Init

Frame 10: 114 bytes on wire (912 bits), 114 bytes captured (912 bits)
Ethernet II, Src: 00:00:00_00:00:00 (00:00:00:00:00:00), Dst: 00:00:00_00:00:00 (00:00:00:00:00:00)
Internet Protocol Version 4, Src: 127.0.0.1, Dst: 127.0.0.1
Transmission Control Protocol, Src Port: 38050, Dst Port: 22, Seq: 1554, Ack: 1098, Len: 48
SSH Protocol

No.     Time           Source                Destination           Protocol Length Info
     11 0.019478       127.0.0.1             127.0.0.1             SSHv2    574    Server: Elliptic Curve Diffie-Hellman Key Exchange Reply, New Keys, Encrypted packet (len=228)

Frame 11: 574 bytes on wire (4592 bits), 574 bytes captured (4592 bits)
Ethernet II, Src: 00:00:00_00:00:00 (00:00:00:00:00:00), Dst: 00:00:00_00:00:00 (00:00:00:00:00:00)
Internet Protocol Version 4, Src: 127.0.0.1, Dst: 127.0.0.1
Transmission Control Protocol, Src Port: 22, Dst Port: 38050, Seq: 1098, Ack: 1602, Len: 508
SSH Protocol

No.     Time           Source                Destination           Protocol Length Info
     12 0.062161       127.0.0.1             127.0.0.1             TCP      66     38050 → 22 [ACK] Seq=1602 Ack=1606 Win=65536 Len=0 TSval=1780136095 TSecr=1780136052

Frame 12: 66 bytes on wire (528 bits), 66 bytes captured (528 bits)
Ethernet II, Src: 00:00:00_00:00:00 (00:00:00:00:00:00), Dst: 00:00:00_00:00:00 (00:00:00:00:00:00)
Internet Protocol Version 4, Src: 127.0.0.1, Dst: 127.0.0.1
Transmission Control Protocol, Src Port: 38050, Dst Port: 22, Seq: 1602, Ack: 1606, Len: 0

No.     Time           Source                Destination           Protocol Length Info
     13 2.539379       127.0.0.1             127.0.0.1             SSHv2    82     Client: New Keys

Frame 13: 82 bytes on wire (656 bits), 82 bytes captured (656 bits)
Ethernet II, Src: 00:00:00_00:00:00 (00:00:00:00:00:00), Dst: 00:00:00_00:00:00 (00:00:00:00:00:00)
Internet Protocol Version 4, Src: 127.0.0.1, Dst: 127.0.0.1
Transmission Control Protocol, Src Port: 38050, Dst Port: 22, Seq: 1602, Ack: 1606, Len: 16
SSH Protocol

No.     Time           Source                Destination           Protocol Length Info
     14 2.585018       127.0.0.1             127.0.0.1             TCP      66     22 → 38050 [ACK] Seq=1606 Ack=1618 Win=65536 Len=0 TSval=1780138618 TSecr=1780138572

Frame 14: 66 bytes on wire (528 bits), 66 bytes captured (528 bits)
Ethernet II, Src: 00:00:00_00:00:00 (00:00:00:00:00:00), Dst: 00:00:00_00:00:00 (00:00:00:00:00:00)
Internet Protocol Version 4, Src: 127.0.0.1, Dst: 127.0.0.1
Transmission Control Protocol, Src Port: 22, Dst Port: 38050, Seq: 1606, Ack: 1618, Len: 0

No.     Time           Source                Destination           Protocol Length Info
     15 2.585033       127.0.0.1             127.0.0.1             SSHv2    110    Client: Encrypted packet (len=44)

Frame 15: 110 bytes on wire (880 bits), 110 bytes captured (880 bits)
Ethernet II, Src: 00:00:00_00:00:00 (00:00:00:00:00:00), Dst: 00:00:00_00:00:00 (00:00:00:00:00:00)
Internet Protocol Version 4, Src: 127.0.0.1, Dst: 127.0.0.1
Transmission Control Protocol, Src Port: 38050, Dst Port: 22, Seq: 1618, Ack: 1606, Len: 44
SSH Protocol

No.     Time           Source                Destination           Protocol Length Info
     16 2.585088       127.0.0.1             127.0.0.1             TCP      66     22 → 38050 [ACK] Seq=1606 Ack=1662 Win=65536 Len=0 TSval=1780138618 TSecr=1780138618

Frame 16: 66 bytes on wire (528 bits), 66 bytes captured (528 bits)
Ethernet II, Src: 00:00:00_00:00:00 (00:00:00:00:00:00), Dst: 00:00:00_00:00:00 (00:00:00:00:00:00)
Internet Protocol Version 4, Src: 127.0.0.1, Dst: 127.0.0.1
Transmission Control Protocol, Src Port: 22, Dst Port: 38050, Seq: 1606, Ack: 1662, Len: 0

No.     Time           Source                Destination           Protocol Length Info
     17 2.585152       127.0.0.1             127.0.0.1             SSHv2    110    Server: Encrypted packet (len=44)

Frame 17: 110 bytes on wire (880 bits), 110 bytes captured (880 bits)
Ethernet II, Src: 00:00:00_00:00:00 (00:00:00:00:00:00), Dst: 00:00:00_00:00:00 (00:00:00:00:00:00)
Internet Protocol Version 4, Src: 127.0.0.1, Dst: 127.0.0.1
Transmission Control Protocol, Src Port: 22, Dst Port: 38050, Seq: 1606, Ack: 1662, Len: 44
SSH Protocol

No.     Time           Source                Destination           Protocol Length Info
     18 2.585196       127.0.0.1             127.0.0.1             TCP      66     38050 → 22 [ACK] Seq=1662 Ack=1650 Win=65536 Len=0 TSval=1780138618 TSecr=1780138618

Frame 18: 66 bytes on wire (528 bits), 66 bytes captured (528 bits)
Ethernet II, Src: 00:00:00_00:00:00 (00:00:00:00:00:00), Dst: 00:00:00_00:00:00 (00:00:00:00:00:00)
Internet Protocol Version 4, Src: 127.0.0.1, Dst: 127.0.0.1
Transmission Control Protocol, Src Port: 38050, Dst Port: 22, Seq: 1662, Ack: 1650, Len: 0

No.     Time           Source                Destination           Protocol Length Info
     19 2.585291       127.0.0.1             127.0.0.1             SSHv2    126    Client: Encrypted packet (len=60)

Frame 19: 126 bytes on wire (1008 bits), 126 bytes captured (1008 bits)
Ethernet II, Src: 00:00:00_00:00:00 (00:00:00:00:00:00), Dst: 00:00:00_00:00:00 (00:00:00:00:00:00)
Internet Protocol Version 4, Src: 127.0.0.1, Dst: 127.0.0.1
Transmission Control Protocol, Src Port: 38050, Dst Port: 22, Seq: 1662, Ack: 1650, Len: 60
SSH Protocol

No.     Time           Source                Destination           Protocol Length Info
     20 2.593471       127.0.0.1             127.0.0.1             SSHv2    118    Server: Encrypted packet (len=52)

Frame 20: 118 bytes on wire (944 bits), 118 bytes captured (944 bits)
Ethernet II, Src: 00:00:00_00:00:00 (00:00:00:00:00:00), Dst: 00:00:00_00:00:00 (00:00:00:00:00:00)
Internet Protocol Version 4, Src: 127.0.0.1, Dst: 127.0.0.1
Transmission Control Protocol, Src Port: 22, Dst Port: 38050, Seq: 1650, Ack: 1722, Len: 52
SSH Protocol

No.     Time           Source                Destination           Protocol Length Info
     21 2.638698       127.0.0.1             127.0.0.1             TCP      66     38050 → 22 [ACK] Seq=1722 Ack=1702 Win=65536 Len=0 TSval=1780138671 TSecr=1780138626

Frame 21: 66 bytes on wire (528 bits), 66 bytes captured (528 bits)
Ethernet II, Src: 00:00:00_00:00:00 (00:00:00:00:00:00), Dst: 00:00:00_00:00:00 (00:00:00:00:00:00)
Internet Protocol Version 4, Src: 127.0.0.1, Dst: 127.0.0.1
Transmission Control Protocol, Src Port: 38050, Dst Port: 22, Seq: 1722, Ack: 1702, Len: 0

No.     Time           Source                Destination           Protocol Length Info
     22 5.150034       127.0.0.1             127.0.0.1             SSHv2    150    Client: Encrypted packet (len=84)

Frame 22: 150 bytes on wire (1200 bits), 150 bytes captured (1200 bits)
Ethernet II, Src: 00:00:00_00:00:00 (00:00:00:00:00:00), Dst: 00:00:00_00:00:00 (00:00:00:00:00:00)
Internet Protocol Version 4, Src: 127.0.0.1, Dst: 127.0.0.1
Transmission Control Protocol, Src Port: 38050, Dst Port: 22, Seq: 1722, Ack: 1702, Len: 84
SSH Protocol

No.     Time           Source                Destination           Protocol Length Info
     23 5.160460       127.0.0.1             127.0.0.1             SSHv2    94     Server: Encrypted packet (len=28)

Frame 23: 94 bytes on wire (752 bits), 94 bytes captured (752 bits)
Ethernet II, Src: 00:00:00_00:00:00 (00:00:00:00:00:00), Dst: 00:00:00_00:00:00 (00:00:00:00:00:00)
Internet Protocol Version 4, Src: 127.0.0.1, Dst: 127.0.0.1
Transmission Control Protocol, Src Port: 22, Dst Port: 38050, Seq: 1702, Ack: 1806, Len: 28
SSH Protocol

No.     Time           Source                Destination           Protocol Length Info
     24 5.160499       127.0.0.1             127.0.0.1             TCP      66     38050 → 22 [ACK] Seq=1806 Ack=1730 Win=65536 Len=0 TSval=1780141193 TSecr=1780141193

Frame 24: 66 bytes on wire (528 bits), 66 bytes captured (528 bits)
Ethernet II, Src: 00:00:00_00:00:00 (00:00:00:00:00:00), Dst: 00:00:00_00:00:00 (00:00:00:00:00:00)
Internet Protocol Version 4, Src: 127.0.0.1, Dst: 127.0.0.1
Transmission Control Protocol, Src Port: 38050, Dst Port: 22, Seq: 1806, Ack: 1730, Len: 0

No.     Time           Source                Destination           Protocol Length Info
     25 5.160605       127.0.0.1             127.0.0.1             SSHv2    178    Client: Encrypted packet (len=112)

Frame 25: 178 bytes on wire (1424 bits), 178 bytes captured (1424 bits)
Ethernet II, Src: 00:00:00_00:00:00 (00:00:00:00:00:00), Dst: 00:00:00_00:00:00 (00:00:00:00:00:00)
Internet Protocol Version 4, Src: 127.0.0.1, Dst: 127.0.0.1
Transmission Control Protocol, Src Port: 38050, Dst Port: 22, Seq: 1806, Ack: 1730, Len: 112
SSH Protocol

No.     Time           Source                Destination           Protocol Length Info
     26 5.179588       127.0.0.1             127.0.0.1             SSHv2    694    Server: Encrypted packet (len=628)

Frame 26: 694 bytes on wire (5552 bits), 694 bytes captured (5552 bits)
Ethernet II, Src: 00:00:00_00:00:00 (00:00:00:00:00:00), Dst: 00:00:00_00:00:00 (00:00:00:00:00:00)
Internet Protocol Version 4, Src: 127.0.0.1, Dst: 127.0.0.1
Transmission Control Protocol, Src Port: 22, Dst Port: 38050, Seq: 1730, Ack: 1918, Len: 628
SSH Protocol

No.     Time           Source                Destination           Protocol Length Info
     27 5.224793       127.0.0.1             127.0.0.1             TCP      66     38050 → 22 [ACK] Seq=1918 Ack=2358 Win=65536 Len=0 TSval=1780141258 TSecr=1780141212

Frame 27: 66 bytes on wire (528 bits), 66 bytes captured (528 bits)
Ethernet II, Src: 00:00:00_00:00:00 (00:00:00:00:00:00), Dst: 00:00:00_00:00:00 (00:00:00:00:00:00)
Internet Protocol Version 4, Src: 127.0.0.1, Dst: 127.0.0.1
Transmission Control Protocol, Src Port: 38050, Dst Port: 22, Seq: 1918, Ack: 2358, Len: 0

No.     Time           Source                Destination           Protocol Length Info
     28 5.224804       127.0.0.1             127.0.0.1             SSHv2    110    Server: Encrypted packet (len=44)

Frame 28: 110 bytes on wire (880 bits), 110 bytes captured (880 bits)
Ethernet II, Src: 00:00:00_00:00:00 (00:00:00:00:00:00), Dst: 00:00:00_00:00:00 (00:00:00:00:00:00)
Internet Protocol Version 4, Src: 127.0.0.1, Dst: 127.0.0.1
Transmission Control Protocol, Src Port: 22, Dst Port: 38050, Seq: 2358, Ack: 1918, Len: 44
SSH Protocol

No.     Time           Source                Destination           Protocol Length Info
     29 5.224855       127.0.0.1             127.0.0.1             TCP      66     38050 → 22 [ACK] Seq=1918 Ack=2402 Win=65536 Len=0 TSval=1780141258 TSecr=1780141258

Frame 29: 66 bytes on wire (528 bits), 66 bytes captured (528 bits)
Ethernet II, Src: 00:00:00_00:00:00 (00:00:00:00:00:00), Dst: 00:00:00_00:00:00 (00:00:00:00:00:00)
Internet Protocol Version 4, Src: 127.0.0.1, Dst: 127.0.0.1
Transmission Control Protocol, Src Port: 38050, Dst Port: 22, Seq: 1918, Ack: 2402, Len: 0

No.     Time           Source                Destination           Protocol Length Info
     30 5.224973       127.0.0.1             127.0.0.1             SSHv2    442    Client: Encrypted packet (len=376)

Frame 30: 442 bytes on wire (3536 bits), 442 bytes captured (3536 bits)
Ethernet II, Src: 00:00:00_00:00:00 (00:00:00:00:00:00), Dst: 00:00:00_00:00:00 (00:00:00:00:00:00)
Internet Protocol Version 4, Src: 127.0.0.1, Dst: 127.0.0.1
Transmission Control Protocol, Src Port: 38050, Dst Port: 22, Seq: 1918, Ack: 2402, Len: 376
SSH Protocol

No.     Time           Source                Destination           Protocol Length Info
     31 5.226408       127.0.0.1             127.0.0.1             SSHv2    174    Server: Encrypted packet (len=108)

Frame 31: 174 bytes on wire (1392 bits), 174 bytes captured (1392 bits)
Ethernet II, Src: 00:00:00_00:00:00 (00:00:00:00:00:00), Dst: 00:00:00_00:00:00 (00:00:00:00:00:00)
Internet Protocol Version 4, Src: 127.0.0.1, Dst: 127.0.0.1
Transmission Control Protocol, Src Port: 22, Dst Port: 38050, Seq: 2402, Ack: 2294, Len: 108
SSH Protocol

No.     Time           Source                Destination           Protocol Length Info
     32 5.226738       127.0.0.1             127.0.0.1             SSHv2    566    Server: Encrypted packet (len=500)

Frame 32: 566 bytes on wire (4528 bits), 566 bytes captured (4528 bits)
Ethernet II, Src: 00:00:00_00:00:00 (00:00:00:00:00:00), Dst: 00:00:00_00:00:00 (00:00:00:00:00:00)
Internet Protocol Version 4, Src: 127.0.0.1, Dst: 127.0.0.1
Transmission Control Protocol, Src Port: 22, Dst Port: 38050, Seq: 2510, Ack: 2294, Len: 500
SSH Protocol

No.     Time           Source                Destination           Protocol Length Info
     33 5.226851       127.0.0.1             127.0.0.1             TCP      66     38050 → 22 [ACK] Seq=2294 Ack=3010 Win=65536 Len=0 TSval=1780141260 TSecr=1780141259

Frame 33: 66 bytes on wire (528 bits), 66 bytes captured (528 bits)
Ethernet II, Src: 00:00:00_00:00:00 (00:00:00:00:00:00), Dst: 00:00:00_00:00:00 (00:00:00:00:00:00)
Internet Protocol Version 4, Src: 127.0.0.1, Dst: 127.0.0.1
Transmission Control Protocol, Src Port: 38050, Dst Port: 22, Seq: 2294, Ack: 3010, Len: 0

No.     Time           Source                Destination           Protocol Length Info
     34 5.248936       127.0.0.1             127.0.0.1             SSHv2    150    Server: Encrypted packet (len=84)

Frame 34: 150 bytes on wire (1200 bits), 150 bytes captured (1200 bits)
Ethernet II, Src: 00:00:00_00:00:00 (00:00:00:00:00:00), Dst: 00:00:00_00:00:00 (00:00:00:00:00:00)
Internet Protocol Version 4, Src: 127.0.0.1, Dst: 127.0.0.1
Transmission Control Protocol, Src Port: 22, Dst Port: 38050, Seq: 3010, Ack: 2294, Len: 84
SSH Protocol

No.     Time           Source                Destination           Protocol Length Info
     35 5.296997       127.0.0.1             127.0.0.1             TCP      66     38050 → 22 [ACK] Seq=2294 Ack=3094 Win=65536 Len=0 TSval=1780141330 TSecr=1780141282

Frame 35: 66 bytes on wire (528 bits), 66 bytes captured (528 bits)
Ethernet II, Src: 00:00:00_00:00:00 (00:00:00:00:00:00), Dst: 00:00:00_00:00:00 (00:00:00:00:00:00)
Internet Protocol Version 4, Src: 127.0.0.1, Dst: 127.0.0.1
Transmission Control Protocol, Src Port: 38050, Dst Port: 22, Seq: 2294, Ack: 3094, Len: 0
