No.     Time           Source                Destination           Protocol Length Info
      1 0.000000000    172.20.0.4            172.20.0.5            TCP      74     54160 → 22 [SYN] Seq=0 Win=64240 Len=0 MSS=1460 SACK_PERM=1 TSval=526104942 TSecr=0 WS=128

Frame 1: 74 bytes on wire (592 bits), 74 bytes captured (592 bits) on interface lab5, id 0
Ethernet II, Src: 02:42:ac:14:00:04 (02:42:ac:14:00:04), Dst: 02:42:ac:14:00:05 (02:42:ac:14:00:05)
Internet Protocol Version 4, Src: 172.20.0.4, Dst: 172.20.0.5
Transmission Control Protocol, Src Port: 54160, Dst Port: 22, Seq: 0, Len: 0

No.     Time           Source                Destination           Protocol Length Info
      2 0.000015400    172.20.0.5            172.20.0.4            TCP      74     22 → 54160 [SYN, ACK] Seq=0 Ack=1 Win=65160 Len=0 MSS=1460 SACK_PERM=1 TSval=1532916445 TSecr=526104942 WS=128

Frame 2: 74 bytes on wire (592 bits), 74 bytes captured (592 bits) on interface lab5, id 0
Ethernet II, Src: 02:42:ac:14:00:05 (02:42:ac:14:00:05), Dst: 02:42:ac:14:00:04 (02:42:ac:14:00:04)
Internet Protocol Version 4, Src: 172.20.0.5, Dst: 172.20.0.4
Transmission Control Protocol, Src Port: 22, Dst Port: 54160, Seq: 0, Ack: 1, Len: 0

No.     Time           Source                Destination           Protocol Length Info
      3 0.000027199    172.20.0.4            172.20.0.5            TCP      66     54160 → 22 [ACK] Seq=1 Ack=1 Win=64256 Len=0 TSval=526104942 TSecr=1532916445

Frame 3: 66 bytes on wire (528 bits), 66 bytes captured (528 bits) on interface lab5, id 0
Ethernet II, Src: 02:42:ac:14:00:04 (02:42:ac:14:00:04), Dst: 02:42:ac:14:00:05 (02:42:ac:14:00:05)
Internet Protocol Version 4, Src: 172.20.0.4, Dst: 172.20.0.5
Transmission Control Protocol, Src Port: 54160, Dst Port: 22, Seq: 1, Ack: 1, Len: 0

No.     Time           Source                Destination           Protocol Length Info
      4 0.000461877    172.20.0.4            172.20.0.5            SSHv2    107    Client: Protocol (SSH-2.0-OpenSSH_7.7p1 Ubuntu-4ubuntu0.3)

Frame 4: 107 bytes on wire (856 bits), 107 bytes captured (856 bits) on interface lab5, id 0
Ethernet II, Src: 02:42:ac:14:00:04 (02:42:ac:14:00:04), Dst: 02:42:ac:14:00:05 (02:42:ac:14:00:05)
Internet Protocol Version 4, Src: 172.20.0.4, Dst: 172.20.0.5
Transmission Control Protocol, Src Port: 54160, Dst Port: 22, Seq: 1, Ack: 1, Len: 41
SSH Protocol

No.     Time           Source                Destination           Protocol Length Info
      5 0.000471157    172.20.0.5            172.20.0.4            TCP      66     22 → 54160 [ACK] Seq=1 Ack=42 Win=65152 Len=0 TSval=1532916446 TSecr=526104943

Frame 5: 66 bytes on wire (528 bits), 66 bytes captured (528 bits) on interface lab5, id 0
Ethernet II, Src: 02:42:ac:14:00:05 (02:42:ac:14:00:05), Dst: 02:42:ac:14:00:04 (02:42:ac:14:00:04)
Internet Protocol Version 4, Src: 172.20.0.5, Dst: 172.20.0.4
Transmission Control Protocol, Src Port: 22, Dst Port: 54160, Seq: 1, Ack: 42, Len: 0

No.     Time           Source                Destination           Protocol Length Info
      6 0.007011230    172.20.0.5            172.20.0.4            SSHv2    107    Server: Protocol (SSH-2.0-OpenSSH_8.3p1 Ubuntu-1ubuntu0.1)

Frame 6: 107 bytes on wire (856 bits), 107 bytes captured (856 bits) on interface lab5, id 0
Ethernet II, Src: 02:42:ac:14:00:05 (02:42:ac:14:00:05), Dst: 02:42:ac:14:00:04 (02:42:ac:14:00:04)
Internet Protocol Version 4, Src: 172.20.0.5, Dst: 172.20.0.4
Transmission Control Protocol, Src Port: 22, Dst Port: 54160, Seq: 1, Ack: 42, Len: 41
SSH Protocol

No.     Time           Source                Destination           Protocol Length Info
      7 0.007069459    172.20.0.4            172.20.0.5            TCP      66     54160 → 22 [ACK] Seq=42 Ack=42 Win=64256 Len=0 TSval=526104949 TSecr=1532916452

Frame 7: 66 bytes on wire (528 bits), 66 bytes captured (528 bits) on interface lab5, id 0
Ethernet II, Src: 02:42:ac:14:00:04 (02:42:ac:14:00:04), Dst: 02:42:ac:14:00:05 (02:42:ac:14:00:05)
Internet Protocol Version 4, Src: 172.20.0.4, Dst: 172.20.0.5
Transmission Control Protocol, Src Port: 54160, Dst Port: 22, Seq: 42, Ack: 42, Len: 0

No.     Time           Source                Destination           Protocol Length Info
      8 0.007258308    172.20.0.4            172.20.0.5            SSHv2    1426   Client: Key Exchange Init

Frame 8: 1426 bytes on wire (11408 bits), 1426 bytes captured (11408 bits) on interface lab5, id 0
Ethernet II, Src: 02:42:ac:14:00:04 (02:42:ac:14:00:04), Dst: 02:42:ac:14:00:05 (02:42:ac:14:00:05)
Internet Protocol Version 4, Src: 172.20.0.4, Dst: 172.20.0.5
Transmission Control Protocol, Src Port: 54160, Dst Port: 22, Seq: 42, Ack: 42, Len: 1360
SSH Protocol

No.     Time           Source                Destination           Protocol Length Info
      9 0.008164164    172.20.0.5            172.20.0.4            SSHv2    1122   Server: Key Exchange Init

Frame 9: 1122 bytes on wire (8976 bits), 1122 bytes captured (8976 bits) on interface lab5, id 0
Ethernet II, Src: 02:42:ac:14:00:05 (02:42:ac:14:00:05), Dst: 02:42:ac:14:00:04 (02:42:ac:14:00:04)
Internet Protocol Version 4, Src: 172.20.0.5, Dst: 172.20.0.4
Transmission Control Protocol, Src Port: 22, Dst Port: 54160, Seq: 42, Ack: 1402, Len: 1056
SSH Protocol

No.     Time           Source                Destination           Protocol Length Info
     10 0.009638074    172.20.0.4            172.20.0.5            SSHv2    114    Client: Elliptic Curve Diffie-Hellman Key Exchange Init

Frame 10: 114 bytes on wire (912 bits), 114 bytes captured (912 bits) on interface lab5, id 0
Ethernet II, Src: 02:42:ac:14:00:04 (02:42:ac:14:00:04), Dst: 02:42:ac:14:00:05 (02:42:ac:14:00:05)
Internet Protocol Version 4, Src: 172.20.0.4, Dst: 172.20.0.5
Transmission Control Protocol, Src Port: 54160, Dst Port: 22, Seq: 1402, Ack: 1098, Len: 48
SSH Protocol

No.     Time           Source                Destination           Protocol Length Info
     11 0.012606397    172.20.0.5            172.20.0.4            SSHv2    574    Server: Elliptic Curve Diffie-Hellman Key Exchange Reply, New Keys, Encrypted packet (len=228)

Frame 11: 574 bytes on wire (4592 bits), 574 bytes captured (4592 bits) on interface lab5, id 0
Ethernet II, Src: 02:42:ac:14:00:05 (02:42:ac:14:00:05), Dst: 02:42:ac:14:00:04 (02:42:ac:14:00:04)
Internet Protocol Version 4, Src: 172.20.0.5, Dst: 172.20.0.4
Transmission Control Protocol, Src Port: 22, Dst Port: 54160, Seq: 1098, Ack: 1450, Len: 508
SSH Protocol

No.     Time           Source                Destination           Protocol Length Info
     12 0.055232732    172.20.0.4            172.20.0.5            TCP      66     54160 → 22 [ACK] Seq=1450 Ack=1606 Win=64128 Len=0 TSval=526104998 TSecr=1532916458

Frame 12: 66 bytes on wire (528 bits), 66 bytes captured (528 bits) on interface lab5, id 0
Ethernet II, Src: 02:42:ac:14:00:04 (02:42:ac:14:00:04), Dst: 02:42:ac:14:00:05 (02:42:ac:14:00:05)
Internet Protocol Version 4, Src: 172.20.0.4, Dst: 172.20.0.5
Transmission Control Protocol, Src Port: 54160, Dst Port: 22, Seq: 1450, Ack: 1606, Len: 0

No.     Time           Source                Destination           Protocol Length Info
     13 2.090435407    172.20.0.4            172.20.0.5            SSHv2    82     Client: New Keys

Frame 13: 82 bytes on wire (656 bits), 82 bytes captured (656 bits) on interface lab5, id 0
Ethernet II, Src: 02:42:ac:14:00:04 (02:42:ac:14:00:04), Dst: 02:42:ac:14:00:05 (02:42:ac:14:00:05)
Internet Protocol Version 4, Src: 172.20.0.4, Dst: 172.20.0.5
Transmission Control Protocol, Src Port: 54160, Dst Port: 22, Seq: 1450, Ack: 1606, Len: 16
SSH Protocol

No.     Time           Source                Destination           Protocol Length Info
     14 2.139933162    172.20.0.5            172.20.0.4            TCP      66     22 → 54160 [ACK] Seq=1606 Ack=1466 Win=64128 Len=0 TSval=1532918585 TSecr=526107033

Frame 14: 66 bytes on wire (528 bits), 66 bytes captured (528 bits) on interface lab5, id 0
Ethernet II, Src: 02:42:ac:14:00:05 (02:42:ac:14:00:05), Dst: 02:42:ac:14:00:04 (02:42:ac:14:00:04)
Internet Protocol Version 4, Src: 172.20.0.5, Dst: 172.20.0.4
Transmission Control Protocol, Src Port: 22, Dst Port: 54160, Seq: 1606, Ack: 1466, Len: 0

No.     Time           Source                Destination           Protocol Length Info
     15 2.139952621    172.20.0.4            172.20.0.5            SSHv2    110    Client: Encrypted packet (len=44)

Frame 15: 110 bytes on wire (880 bits), 110 bytes captured (880 bits) on interface lab5, id 0
Ethernet II, Src: 02:42:ac:14:00:04 (02:42:ac:14:00:04), Dst: 02:42:ac:14:00:05 (02:42:ac:14:00:05)
Internet Protocol Version 4, Src: 172.20.0.4, Dst: 172.20.0.5
Transmission Control Protocol, Src Port: 54160, Dst Port: 22, Seq: 1466, Ack: 1606, Len: 44
SSH Protocol

No.     Time           Source                Destination           Protocol Length Info
     16 2.140013371    172.20.0.5            172.20.0.4            TCP      66     22 → 54160 [ACK] Seq=1606 Ack=1510 Win=64128 Len=0 TSval=1532918585 TSecr=526107082

Frame 16: 66 bytes on wire (528 bits), 66 bytes captured (528 bits) on interface lab5, id 0
Ethernet II, Src: 02:42:ac:14:00:05 (02:42:ac:14:00:05), Dst: 02:42:ac:14:00:04 (02:42:ac:14:00:04)
Internet Protocol Version 4, Src: 172.20.0.5, Dst: 172.20.0.4
Transmission Control Protocol, Src Port: 22, Dst Port: 54160, Seq: 1606, Ack: 1510, Len: 0

No.     Time           Source                Destination           Protocol Length Info
     17 2.140162911    172.20.0.5            172.20.0.4            SSHv2    110    Server: Encrypted packet (len=44)

Frame 17: 110 bytes on wire (880 bits), 110 bytes captured (880 bits) on interface lab5, id 0
Ethernet II, Src: 02:42:ac:14:00:05 (02:42:ac:14:00:05), Dst: 02:42:ac:14:00:04 (02:42:ac:14:00:04)
Internet Protocol Version 4, Src: 172.20.0.5, Dst: 172.20.0.4
Transmission Control Protocol, Src Port: 22, Dst Port: 54160, Seq: 1606, Ack: 1510, Len: 44
SSH Protocol

No.     Time           Source                Destination           Protocol Length Info
     18 2.140212510    172.20.0.4            172.20.0.5            TCP      66     54160 → 22 [ACK] Seq=1510 Ack=1650 Win=64128 Len=0 TSval=526107083 TSecr=1532918586

Frame 18: 66 bytes on wire (528 bits), 66 bytes captured (528 bits) on interface lab5, id 0
Ethernet II, Src: 02:42:ac:14:00:04 (02:42:ac:14:00:04), Dst: 02:42:ac:14:00:05 (02:42:ac:14:00:05)
Internet Protocol Version 4, Src: 172.20.0.4, Dst: 172.20.0.5
Transmission Control Protocol, Src Port: 54160, Dst Port: 22, Seq: 1510, Ack: 1650, Len: 0

No.     Time           Source                Destination           Protocol Length Info
     19 2.140282520    172.20.0.4            172.20.0.5            SSHv2    126    Client: Encrypted packet (len=60)

Frame 19: 126 bytes on wire (1008 bits), 126 bytes captured (1008 bits) on interface lab5, id 0
Ethernet II, Src: 02:42:ac:14:00:04 (02:42:ac:14:00:04), Dst: 02:42:ac:14:00:05 (02:42:ac:14:00:05)
Internet Protocol Version 4, Src: 172.20.0.4, Dst: 172.20.0.5
Transmission Control Protocol, Src Port: 54160, Dst Port: 22, Seq: 1510, Ack: 1650, Len: 60
SSH Protocol

No.     Time           Source                Destination           Protocol Length Info
     20 2.150818339    172.20.0.5            172.20.0.4            SSHv2    118    Server: Encrypted packet (len=52)

Frame 20: 118 bytes on wire (944 bits), 118 bytes captured (944 bits) on interface lab5, id 0
Ethernet II, Src: 02:42:ac:14:00:05 (02:42:ac:14:00:05), Dst: 02:42:ac:14:00:04 (02:42:ac:14:00:04)
Internet Protocol Version 4, Src: 172.20.0.5, Dst: 172.20.0.4
Transmission Control Protocol, Src Port: 22, Dst Port: 54160, Seq: 1650, Ack: 1570, Len: 52
SSH Protocol

No.     Time           Source                Destination           Protocol Length Info
     21 2.202773479    172.20.0.4            172.20.0.5            TCP      66     54160 → 22 [ACK] Seq=1570 Ack=1702 Win=64128 Len=0 TSval=526107145 TSecr=1532918596

Frame 21: 66 bytes on wire (528 bits), 66 bytes captured (528 bits) on interface lab5, id 0
Ethernet II, Src: 02:42:ac:14:00:04 (02:42:ac:14:00:04), Dst: 02:42:ac:14:00:05 (02:42:ac:14:00:05)
Internet Protocol Version 4, Src: 172.20.0.4, Dst: 172.20.0.5
Transmission Control Protocol, Src Port: 54160, Dst Port: 22, Seq: 1570, Ack: 1702, Len: 0

No.     Time           Source                Destination           Protocol Length Info
     22 4.260993146    172.20.0.4            172.20.0.5            SSHv2    150    Client: Encrypted packet (len=84)

Frame 22: 150 bytes on wire (1200 bits), 150 bytes captured (1200 bits) on interface lab5, id 0
Ethernet II, Src: 02:42:ac:14:00:04 (02:42:ac:14:00:04), Dst: 02:42:ac:14:00:05 (02:42:ac:14:00:05)
Internet Protocol Version 4, Src: 172.20.0.4, Dst: 172.20.0.5
Transmission Control Protocol, Src Port: 54160, Dst Port: 22, Seq: 1570, Ack: 1702, Len: 84
SSH Protocol

No.     Time           Source                Destination           Protocol Length Info
     23 4.275466302    172.20.0.5            172.20.0.4            SSHv2    94     Server: Encrypted packet (len=28)

Frame 23: 94 bytes on wire (752 bits), 94 bytes captured (752 bits) on interface lab5, id 0
Ethernet II, Src: 02:42:ac:14:00:05 (02:42:ac:14:00:05), Dst: 02:42:ac:14:00:04 (02:42:ac:14:00:04)
Internet Protocol Version 4, Src: 172.20.0.5, Dst: 172.20.0.4
Transmission Control Protocol, Src Port: 22, Dst Port: 54160, Seq: 1702, Ack: 1654, Len: 28
SSH Protocol

No.     Time           Source                Destination           Protocol Length Info
     24 4.275515103    172.20.0.4            172.20.0.5            TCP      66     54160 → 22 [ACK] Seq=1654 Ack=1730 Win=64128 Len=0 TSval=526109218 TSecr=1532920721

Frame 24: 66 bytes on wire (528 bits), 66 bytes captured (528 bits) on interface lab5, id 0
Ethernet II, Src: 02:42:ac:14:00:04 (02:42:ac:14:00:04), Dst: 02:42:ac:14:00:05 (02:42:ac:14:00:05)
Internet Protocol Version 4, Src: 172.20.0.4, Dst: 172.20.0.5
Transmission Control Protocol, Src Port: 54160, Dst Port: 22, Seq: 1654, Ack: 1730, Len: 0

No.     Time           Source                Destination           Protocol Length Info
     25 4.275653791    172.20.0.4            172.20.0.5            SSHv2    178    Client: Encrypted packet (len=112)

Frame 25: 178 bytes on wire (1424 bits), 178 bytes captured (1424 bits) on interface lab5, id 0
Ethernet II, Src: 02:42:ac:14:00:04 (02:42:ac:14:00:04), Dst: 02:42:ac:14:00:05 (02:42:ac:14:00:05)
Internet Protocol Version 4, Src: 172.20.0.4, Dst: 172.20.0.5
Transmission Control Protocol, Src Port: 54160, Dst Port: 22, Seq: 1654, Ack: 1730, Len: 112
SSH Protocol

No.     Time           Source                Destination           Protocol Length Info
     26 4.290462156    172.20.0.5            172.20.0.4            SSHv2    694    Server: Encrypted packet (len=628)

Frame 26: 694 bytes on wire (5552 bits), 694 bytes captured (5552 bits) on interface lab5, id 0
Ethernet II, Src: 02:42:ac:14:00:05 (02:42:ac:14:00:05), Dst: 02:42:ac:14:00:04 (02:42:ac:14:00:04)
Internet Protocol Version 4, Src: 172.20.0.5, Dst: 172.20.0.4
Transmission Control Protocol, Src Port: 22, Dst Port: 54160, Seq: 1730, Ack: 1766, Len: 628
SSH Protocol

No.     Time           Source                Destination           Protocol Length Info
     27 4.335323905    172.20.0.4            172.20.0.5            TCP      66     54160 → 22 [ACK] Seq=1766 Ack=2358 Win=64128 Len=0 TSval=526109278 TSecr=1532920736

Frame 27: 66 bytes on wire (528 bits), 66 bytes captured (528 bits) on interface lab5, id 0
Ethernet II, Src: 02:42:ac:14:00:04 (02:42:ac:14:00:04), Dst: 02:42:ac:14:00:05 (02:42:ac:14:00:05)
Internet Protocol Version 4, Src: 172.20.0.4, Dst: 172.20.0.5
Transmission Control Protocol, Src Port: 54160, Dst Port: 22, Seq: 1766, Ack: 2358, Len: 0

No.     Time           Source                Destination           Protocol Length Info
     28 4.335342115    172.20.0.5            172.20.0.4            SSHv2    110    Server: Encrypted packet (len=44)

Frame 28: 110 bytes on wire (880 bits), 110 bytes captured (880 bits) on interface lab5, id 0
Ethernet II, Src: 02:42:ac:14:00:05 (02:42:ac:14:00:05), Dst: 02:42:ac:14:00:04 (02:42:ac:14:00:04)
Internet Protocol Version 4, Src: 172.20.0.5, Dst: 172.20.0.4
Transmission Control Protocol, Src Port: 22, Dst Port: 54160, Seq: 2358, Ack: 1766, Len: 44
SSH Protocol

No.     Time           Source                Destination           Protocol Length Info
     29 4.335405355    172.20.0.4            172.20.0.5            TCP      66     54160 → 22 [ACK] Seq=1766 Ack=2402 Win=64128 Len=0 TSval=526109278 TSecr=1532920781

Frame 29: 66 bytes on wire (528 bits), 66 bytes captured (528 bits) on interface lab5, id 0
Ethernet II, Src: 02:42:ac:14:00:04 (02:42:ac:14:00:04), Dst: 02:42:ac:14:00:05 (02:42:ac:14:00:05)
Internet Protocol Version 4, Src: 172.20.0.4, Dst: 172.20.0.5
Transmission Control Protocol, Src Port: 54160, Dst Port: 22, Seq: 1766, Ack: 2402, Len: 0

No.     Time           Source                Destination           Protocol Length Info
     30 4.335510914    172.20.0.4            172.20.0.5            SSHv2    442    Client: Encrypted packet (len=376)

Frame 30: 442 bytes on wire (3536 bits), 442 bytes captured (3536 bits) on interface lab5, id 0
Ethernet II, Src: 02:42:ac:14:00:04 (02:42:ac:14:00:04), Dst: 02:42:ac:14:00:05 (02:42:ac:14:00:05)
Internet Protocol Version 4, Src: 172.20.0.4, Dst: 172.20.0.5
Transmission Control Protocol, Src Port: 54160, Dst Port: 22, Seq: 1766, Ack: 2402, Len: 376
SSH Protocol

No.     Time           Source                Destination           Protocol Length Info
     31 4.336926676    172.20.0.5            172.20.0.4            SSHv2    174    Server: Encrypted packet (len=108)

Frame 31: 174 bytes on wire (1392 bits), 174 bytes captured (1392 bits) on interface lab5, id 0
Ethernet II, Src: 02:42:ac:14:00:05 (02:42:ac:14:00:05), Dst: 02:42:ac:14:00:04 (02:42:ac:14:00:04)
Internet Protocol Version 4, Src: 172.20.0.5, Dst: 172.20.0.4
Transmission Control Protocol, Src Port: 22, Dst Port: 54160, Seq: 2402, Ack: 2142, Len: 108
SSH Protocol

No.     Time           Source                Destination           Protocol Length Info
     32 4.337253564    172.20.0.5            172.20.0.4            SSHv2    566    Server: Encrypted packet (len=500)

Frame 32: 566 bytes on wire (4528 bits), 566 bytes captured (4528 bits) on interface lab5, id 0
Ethernet II, Src: 02:42:ac:14:00:05 (02:42:ac:14:00:05), Dst: 02:42:ac:14:00:04 (02:42:ac:14:00:04)
Internet Protocol Version 4, Src: 172.20.0.5, Dst: 172.20.0.4
Transmission Control Protocol, Src Port: 22, Dst Port: 54160, Seq: 2510, Ack: 2142, Len: 500
SSH Protocol

No.     Time           Source                Destination           Protocol Length Info
     33 4.337382254    172.20.0.4            172.20.0.5            TCP      66     54160 → 22 [ACK] Seq=2142 Ack=3010 Win=64128 Len=0 TSval=526109280 TSecr=1532920782

Frame 33: 66 bytes on wire (528 bits), 66 bytes captured (528 bits) on interface lab5, id 0
Ethernet II, Src: 02:42:ac:14:00:04 (02:42:ac:14:00:04), Dst: 02:42:ac:14:00:05 (02:42:ac:14:00:05)
Internet Protocol Version 4, Src: 172.20.0.4, Dst: 172.20.0.5
Transmission Control Protocol, Src Port: 54160, Dst Port: 22, Seq: 2142, Ack: 3010, Len: 0

No.     Time           Source                Destination           Protocol Length Info
     34 4.343898176    172.20.0.5            172.20.0.4            SSHv2    150    Server: Encrypted packet (len=84)

Frame 34: 150 bytes on wire (1200 bits), 150 bytes captured (1200 bits) on interface lab5, id 0
Ethernet II, Src: 02:42:ac:14:00:05 (02:42:ac:14:00:05), Dst: 02:42:ac:14:00:04 (02:42:ac:14:00:04)
Internet Protocol Version 4, Src: 172.20.0.5, Dst: 172.20.0.4
Transmission Control Protocol, Src Port: 22, Dst Port: 54160, Seq: 3010, Ack: 2142, Len: 84
SSH Protocol

No.     Time           Source                Destination           Protocol Length Info
     35 4.383961264    172.20.0.4            172.20.0.5            TCP      66     54160 → 22 [ACK] Seq=2142 Ack=3094 Win=64128 Len=0 TSval=526109326 TSecr=1532920789

Frame 35: 66 bytes on wire (528 bits), 66 bytes captured (528 bits) on interface lab5, id 0
Ethernet II, Src: 02:42:ac:14:00:04 (02:42:ac:14:00:04), Dst: 02:42:ac:14:00:05 (02:42:ac:14:00:05)
Internet Protocol Version 4, Src: 172.20.0.4, Dst: 172.20.0.5
Transmission Control Protocol, Src Port: 54160, Dst Port: 22, Seq: 2142, Ack: 3094, Len: 0
